{"$schema":"../schemas/passage-index.schema.json","alignment":{"note":"English passages are addressable below the segment level; Latin correspondence is asserted only for the containing source segment.","precision":"segment","unit":"source-segment"},"annotations":[{"body":{"format":"text/plain","language":"en","purpose":"tagging","tag":"unclear","type":"TextualBody","value":"[unclear]"},"html_id":"a-en-0001-0012-001","id":"trc:prdl-24375_de-vera-conversione-mentis-ad-deum:seg-0001:p-0012:annotation-001","motivation":"describing","target":{"selector":{"conformsTo":"https://www.w3.org/TR/media-frags/","type":"FragmentSelector","value":"a-en-0001-0012-001"},"source":"trc:prdl-24375_de-vera-conversione-mentis-ad-deum:seg-0001:p-0012"},"type":"Annotation"},{"body":{"format":"text/plain","language":"en","purpose":"tagging","tag":"unclear","type":"TextualBody","value":"[unclear]"},"html_id":"a-en-0001-0012-002","id":"trc:prdl-24375_de-vera-conversione-mentis-ad-deum:seg-0001:p-0012:annotation-002","motivation":"describing","target":{"selector":{"conformsTo":"https://www.w3.org/TR/media-frags/","type":"FragmentSelector","value":"a-en-0001-0012-002"},"source":"trc:prdl-24375_de-vera-conversione-mentis-ad-deum:seg-0001:p-0012"},"type":"Annotation"},{"body":{"format":"text/plain","language":"en","purpose":"tagging","tag":"unclear","type":"TextualBody","value":"[unclear]"},"html_id":"a-en-0001-0012-003","id":"trc:prdl-24375_de-vera-conversione-mentis-ad-deum:seg-0001:p-0012:annotation-003","motivation":"describing","target":{"selector":{"conformsTo":"https://www.w3.org/TR/media-frags/","type":"FragmentSelector","value":"a-en-0001-0012-003"},"source":"trc:prdl-24375_de-vera-conversione-mentis-ad-deum:seg-0001:p-0012"},"type":"Annotation"},{"body":{"format":"text/plain","language":"en","purpose":"tagging","tag":"unclear","type":"TextualBody","value":"[unclear]"},"html_id":"a-en-0002-0001-001","id":"trc:prdl-24375_de-vera-conversione-mentis-ad-deum:seg-0002:p-0001:annotation-001","motivation":"describing","target":{"selector":{"conformsTo":"https://www.w3.org/TR/media-frags/","type":"FragmentSelector","value":"a-en-0002-0001-001"},"source":"trc:prdl-24375_de-vera-conversione-mentis-ad-deum:seg-0002:p-0001"},"type":"Annotation"},{"body":{"format":"text/plain","language":"en","purpose":"tagging","tag":"unclear","type":"TextualBody","value":"[unclear]"},"html_id":"a-en-0002-0002-001","id":"trc:prdl-24375_de-vera-conversione-mentis-ad-deum:seg-0002:p-0002:annotation-001","motivation":"describing","target":{"selector":{"conformsTo":"https://www.w3.org/TR/media-frags/","type":"FragmentSelector","value":"a-en-0002-0002-001"},"source":"trc:prdl-24375_de-vera-conversione-mentis-ad-deum:seg-0002:p-0002"},"type":"Annotation"},{"body":{"format":"text/plain","language":"en","purpose":"tagging","tag":"unclear","type":"TextualBody","value":"[unclear]"},"html_id":"a-en-0002-0002-002","id":"trc:prdl-24375_de-vera-conversione-mentis-ad-deum:seg-0002:p-0002:annotation-002","motivation":"describing","target":{"selector":{"conformsTo":"https://www.w3.org/TR/media-frags/","type":"FragmentSelector","value":"a-en-0002-0002-002"},"source":"trc:prdl-24375_de-vera-conversione-mentis-ad-deum:seg-0002:p-0002"},"type":"Annotation"},{"body":{"format":"text/plain","language":"en","purpose":"tagging","tag":"unclear","type":"TextualBody","value":"[unclear]"},"html_id":"a-en-0002-0002-003","id":"trc:prdl-24375_de-vera-conversione-mentis-ad-deum:seg-0002:p-0002:annotation-003","motivation":"describing","target":{"selector":{"conformsTo":"https://www.w3.org/TR/media-frags/","type":"FragmentSelector","value":"a-en-0002-0002-003"},"source":"trc:prdl-24375_de-vera-conversione-mentis-ad-deum:seg-0002:p-0002"},"type":"Annotation"},{"body":{"format":"text/plain","language":"en","purpose":"tagging","tag":"unclear","type":"TextualBody","value":"[unclear]"},"html_id":"a-en-0002-0003-001","id":"trc:prdl-24375_de-vera-conversione-mentis-ad-deum:seg-0002:p-0003:annotation-001","motivation":"describing","target":{"selector":{"conformsTo":"https://www.w3.org/TR/media-frags/","type":"FragmentSelector","value":"a-en-0002-0003-001"},"source":"trc:prdl-24375_de-vera-conversione-mentis-ad-deum:seg-0002:p-0003"},"type":"Annotation"},{"body":{"format":"text/plain","language":"en","purpose":"tagging","tag":"unclear","type":"TextualBody","value":"[unclear]"},"html_id":"a-en-0003-0001-001","id":"trc:prdl-24375_de-vera-conversione-mentis-ad-deum:seg-0003:p-0001:annotation-001","motivation":"describing","target":{"selector":{"conformsTo":"https://www.w3.org/TR/media-frags/","type":"FragmentSelector","value":"a-en-0003-0001-001"},"source":"trc:prdl-24375_de-vera-conversione-mentis-ad-deum:seg-0003:p-0001"},"type":"Annotation"},{"body":{"format":"text/plain","language":"en","purpose":"tagging","tag":"unclear","type":"TextualBody","value":"[unclear]"},"html_id":"a-en-0003-0001-002","id":"trc:prdl-24375_de-vera-conversione-mentis-ad-deum:seg-0003:p-0001:annotation-002","motivation":"describing","target":{"selector":{"conformsTo":"https://www.w3.org/TR/media-frags/","type":"FragmentSelector","value":"a-en-0003-0001-002"},"source":"trc:prdl-24375_de-vera-conversione-mentis-ad-deum:seg-0003:p-0001"},"type":"Annotation"},{"body":{"format":"text/plain","language":"en","purpose":"tagging","tag":"unclear","type":"TextualBody","value":"[unclear]"},"html_id":"a-en-0003-0001-003","id":"trc:prdl-24375_de-vera-conversione-mentis-ad-deum:seg-0003:p-0001:annotation-003","motivation":"describing","target":{"selector":{"conformsTo":"https://www.w3.org/TR/media-frags/","type":"FragmentSelector","value":"a-en-0003-0001-003"},"source":"trc:prdl-24375_de-vera-conversione-mentis-ad-deum:seg-0003:p-0001"},"type":"Annotation"},{"body":{"format":"text/plain","language":"en","purpose":"tagging","tag":"unclear","type":"TextualBody","value":"[unclear]"},"html_id":"a-en-0003-0001-004","id":"trc:prdl-24375_de-vera-conversione-mentis-ad-deum:seg-0003:p-0001:annotation-004","motivation":"describing","target":{"selector":{"conformsTo":"https://www.w3.org/TR/media-frags/","type":"FragmentSelector","value":"a-en-0003-0001-004"},"source":"trc:prdl-24375_de-vera-conversione-mentis-ad-deum:seg-0003:p-0001"},"type":"Annotation"},{"body":{"format":"text/plain","language":"en","purpose":"tagging","tag":"unclear","type":"TextualBody","value":"[unclear]"},"html_id":"a-en-0004-0003-001","id":"trc:prdl-24375_de-vera-conversione-mentis-ad-deum:seg-0004:p-0003:annotation-001","motivation":"describing","target":{"selector":{"conformsTo":"https://www.w3.org/TR/media-frags/","type":"FragmentSelector","value":"a-en-0004-0003-001"},"source":"trc:prdl-24375_de-vera-conversione-mentis-ad-deum:seg-0004:p-0003"},"type":"Annotation"},{"body":{"format":"text/plain","language":"en","purpose":"tagging","tag":"unclear","type":"TextualBody","value":"[unclear]"},"html_id":"a-en-0005-0001-001","id":"trc:prdl-24375_de-vera-conversione-mentis-ad-deum:seg-0005:p-0001:annotation-001","motivation":"describing","target":{"selector":{"conformsTo":"https://www.w3.org/TR/media-frags/","type":"FragmentSelector","value":"a-en-0005-0001-001"},"source":"trc:prdl-24375_de-vera-conversione-mentis-ad-deum:seg-0005:p-0001"},"type":"Annotation"},{"body":{"format":"text/plain","language":"en","purpose":"tagging","tag":"unclear","type":"TextualBody","value":"[unclear]"},"html_id":"a-en-0007-0001-001","id":"trc:prdl-24375_de-vera-conversione-mentis-ad-deum:seg-0007:p-0001:annotation-001","motivation":"describing","target":{"selector":{"conformsTo":"https://www.w3.org/TR/media-frags/","type":"FragmentSelector","value":"a-en-0007-0001-001"},"source":"trc:prdl-24375_de-vera-conversione-mentis-ad-deum:seg-0007:p-0001"},"type":"Annotation"},{"body":{"format":"text/plain","language":"en","purpose":"tagging","tag":"unclear","type":"TextualBody","value":"[unclear]"},"html_id":"a-en-0007-0001-002","id":"trc:prdl-24375_de-vera-conversione-mentis-ad-deum:seg-0007:p-0001:annotation-002","motivation":"describing","target":{"selector":{"conformsTo":"https://www.w3.org/TR/media-frags/","type":"FragmentSelector","value":"a-en-0007-0001-002"},"source":"trc:prdl-24375_de-vera-conversione-mentis-ad-deum:seg-0007:p-0001"},"type":"Annotation"},{"body":{"format":"text/plain","language":"en","purpose":"tagging","tag":"unclear","type":"TextualBody","value":"[unclear]"},"html_id":"a-en-0008-0001-001","id":"trc:prdl-24375_de-vera-conversione-mentis-ad-deum:seg-0008:p-0001:annotation-001","motivation":"describing","target":{"selector":{"conformsTo":"https://www.w3.org/TR/media-frags/","type":"FragmentSelector","value":"a-en-0008-0001-001"},"source":"trc:prdl-24375_de-vera-conversione-mentis-ad-deum:seg-0008:p-0001"},"type":"Annotation"},{"body":{"format":"text/plain","language":"en","purpose":"tagging","tag":"unclear","type":"TextualBody","value":"[unclear]"},"html_id":"a-en-0009-0001-001","id":"trc:prdl-24375_de-vera-conversione-mentis-ad-deum:seg-0009:p-0001:annotation-001","motivation":"describing","target":{"selector":{"conformsTo":"https://www.w3.org/TR/media-frags/","type":"FragmentSelector","value":"a-en-0009-0001-001"},"source":"trc:prdl-24375_de-vera-conversione-mentis-ad-deum:seg-0009:p-0001"},"type":"Annotation"},{"body":{"format":"text/plain","language":"en","purpose":"tagging","tag":"unclear","type":"TextualBody","value":"[unclear]"},"html_id":"a-en-0009-0001-002","id":"trc:prdl-24375_de-vera-conversione-mentis-ad-deum:seg-0009:p-0001:annotation-002","motivation":"describing","target":{"selector":{"conformsTo":"https://www.w3.org/TR/media-frags/","type":"FragmentSelector","value":"a-en-0009-0001-002"},"source":"trc:prdl-24375_de-vera-conversione-mentis-ad-deum:seg-0009:p-0001"},"type":"Annotation"},{"body":{"format":"text/plain","language":"en","purpose":"tagging","tag":"unclear","type":"TextualBody","value":"[unclear]"},"html_id":"a-en-0013-0002-001","id":"trc:prdl-24375_de-vera-conversione-mentis-ad-deum:seg-0013:p-0002:annotation-001","motivation":"describing","target":{"selector":{